{
  "id": "chatcut",
  "version": "v1",
  "job": "editable motion graphics and final timeline assembly",
  "preview": "adapter:chatcut",
  "renderer": "chatcut",
  "implementation_ref": "external:chatcut-plugin-basics",
  "license": "external",
  "capabilities": ["motion.produce", "timeline.assemble"],
  "accepts": ["motion-contract-v1", "scene-contract-v1", "timeline-contract-v1"],
  "outputs": ["chatcut-project", "editable-motion-graphic", "rendered-video"],
  "editable": true,
  "installed_skill": "chatcut:chatcut-plugin-basics",
  "fallback": null,
  "license_mode": "external-reference"
}
