{
  "id": "remotion",
  "version": "v1",
  "job": "programmatic full-frame motion and render",
  "preview": "adapter:remotion",
  "renderer": "remotion",
  "implementation_ref": "external:remotion-best-practices",
  "license": "external",
  "capabilities": ["motion.preview", "motion.produce"],
  "accepts": ["motion-contract-v1", "scene-contract-v1"],
  "outputs": ["remotion-composition", "snapshot", "rendered-video"],
  "editable": true,
  "installed_skill": "remotion-best-practices",
  "fallback": "hyperframes",
  "license_mode": "external-reference"
}
